salary_is_predicted,description,id,title,created,salary_max,salary_min,area,location,company,category,tag,contract_type
0,"Vous êtes développeur Java et on vous reconnait pour votre créativité ? Aujourd’hui, vous avez envie d’intégrer une équipe au sein de laquelle vous pourrez apprendre et partager vos connaissances ? Alors, nous avons la mission qu’il vous faut  Nous recherchons un profil Ingénieur Java Fullstack (70% Back et 30% Front) pour rejoindre la DSI de notre client dans le secteur Bancaire. En relation avec le leader technique et le chef de projet fonctionnel, vous prendrez en charge les différents besoi…",4173977913,Ingénieur·e Java Fullstack H/F,2023-06-28T01:10:35Z,60000.0,40000.0,['France'],France,Attineos,Emplois Informatique,it-jobs,
0,"Qui sommes nous Euro-Information, filiale technologique de Crédit Mutuel Alliance Fédérale, conçoit, réalise, maintient et exploite un système d'information commun utilisé par le Groupe. Les activités de développement et de production informatique au niveau national et international sont assurées par environ 4000 salariés répartis sur plusieurs sites géographiques au niveau national : Strasbourg, Nancy, Dijon, Orléans, Lyon, Lille, Cergy, Val de Fontenay, Paris et Nantes. Première Banque à adop…",4216186504,Ingénieur Système Métriques de Performance H/F,2023-07-21T06:24:00Z,60000.0,35000.0,"['France', 'Auvergne-Rhône-Alpes', 'Rhône', 'Lyon', 'Tassin-la-Demi-Lune']","Tassin-la-Demi-Lune, Lyon",EURO INFORMATION PRODUCTION,Emplois Informatique,it-jobs,
0,"Vous voulez intégrer une PME en pleine croissance ? Une équipe dynamique ? Des projets intéressants ? Rejoignez les équipes de notre client partenaire en tant que Chef de projet F/H, votre rôle sera de coordonner le déploiement de la solution logicielle chez les nouveaux clients. Vos responsabilités seront les suivantes : - Réaliser l'analyse et valider la reprise des données en collaboration avec notre référent ""récupération de données"" - Effectuer le paramétrage des solutions - Assurer la for…",4254633003,Chef de Projet Applicatif H/F,2023-08-11T06:45:11Z,40000.0,35000.0,"['France', 'Auvergne-Rhône-Alpes', 'Rhône', 'Lyon', 'Décines-Charpieu']","Décines-Charpieu, Lyon",Groupagora,Emplois Informatique,it-jobs,
0,"Job Description Rimini Street, Inc., is a fast-growing global leader delivering unified software support and services. We empower licensees of Oracle, SAP, IBM, Microsoft, Salesforce®, and other cloud and locally hosted enterprise software to extract more value from their investments, advance innovation, create competitive advantage, and fuel growth. With nearly 5000 clients served to date, we are the largest independent, full-stack ERP support and services company. Organizations who rely on ou…",4200462848,IT Project Manager (Remote Brazil),2023-07-11T19:53:49Z,60000.0,40000.0,['France'],France,"Rimini Street, Inc.",Emplois Informatique,it-jobs,
0,"Rôle/Finalité de l'emploi : - Identifier, analyser et corriger les différents incidents signalés par les utilisateurs afin de garantir un service de qualité aux utilisateurs Missions principales : - Identifier les anomalies et proposer des solutions de contournement - Développer des correctifs et les déployer en production - Communiquer et rédiger des comptes rendus à propos des incidents - Animer et participer à la gestion des crises - Mettre à disposition des procédures d'assistance - Partici…",4216185999,Ingenieur Support Applicatif H/F,2023-07-21T06:23:58Z,,,"['France', 'Normandie', 'Calvados']","Calvados, Normandie",EM Normandie RH,Emplois Informatique,it-jobs,
0,"SKEEPERS is an innovative group that is changing the world of customer experience. With a strong international ambition, SKEEPERS helps brands generate value by and for their customers. With its' one for all platform, SKEEPERS provides brands with a complete solution that allows them to prescriptively activate data collected from customer feedback for marketing purposes. Recognised as a high-growth group, SKEEPERS has already made it into the Next120 ranking one of the most innovative SaaS comp…",4236397989,Cloud Architect (F/M/X),2023-08-01T20:23:11Z,60000.0,40000.0,"['France', ""Provence-Alpes-Côte d'Azur"", 'Bouches-du-Rhône', 'Marseille']","Marseille, Bouches-du-Rhône",SKEEPERS Group,Emplois Informatique,it-jobs,
0,"About PriceHubble PriceHubble is a PropTech company, set to radically improve the understanding and transparency of real estate markets based on data-driven insights. We aggregate and analyse a wide variety of data, run big data analytics and use state-of-the art machine learning to generate stable and reliable valuations and predictive analytics for the real estate market. We are headquartered in Zürich, with offices in Paris, Berlin, Hamburg, Vienna, Amsterdam and Tokyo. We work on internatio…",4224120561,Senior Data Scientist H/F,2023-07-26T07:18:58Z,,,"['France', 'Ile-de-France', 'Paris']","Paris, Ile-de-France",PriceHubble,Emplois Informatique,it-jobs,
0,"Rejoindre UTIGroup, c'est rejoindre une Société à taille humaine qui investit sur l'accompagnement de ses Consultants, et où la prise de décision est rapide. Certifiée ISO 9001/2015, UTIGroup a eu 35 ans en 2021. Solidité et transparence financière (notre société est cotée en Bourse depuis plus de 20 ans Notation ECO-Vadis exceptionnelle (73/100) : niveau PLATINIUM (RSE, éthique, social et achats responsables) UTIGroup respecte les textes internationaux, européens et la législation Française en…",4199606815,Architecte Azure H/F,2023-07-11T07:58:09Z,65000.0,55000.0,"['France', 'Auvergne-Rhône-Alpes', 'Rhône']","Rhône, Auvergne-Rhône-Alpes",Utigroup,Emplois Informatique,it-jobs,
0,"CNAM Participez à la performance et la qualité d'un système d'information de tout premier plan en France voire en Europe : 60 millions de bénéficiaires,  de 1500 informaticiens, 1 milliard de feuilles de soin électroniques par an, 80.000 utilisateurs, le site Ameli est le 3ème site internet de service public consulté avec des télé services pour les assurés, les professionnels de santé et les entreprises, une capacité de stockage des données de plus de 500 To Au sein de la DDSI, la direction du …",4230218069,Product Owner Responsable d'Applications H/F,2023-07-29T06:03:29Z,50000.0,40000.0,"['France', 'Pays de la Loire', 'Maine-et-Loire', 'Angers', 'Angers-Est']","Angers-Est, Angers",Lasecurecrute.fr,Emplois Informatique,it-jobs,
0,".Net Core Developer for IT Company in SURAT,GUJARAT Work Experience: 2.0 Year(s) To 5.0 Year(s) Function: IT Software- Application Programming / Maintenance Industry: IT-Software/Software Services Responsibilities: • Translate application storyboards and use cases into functional applications. • Design, build and maintain efficient, reusable, and reliable code. • Integrate data storage solutions. • Participate in requirements analysis. • Collaborate with internal teams to produce software desig…",4173973442,".Net Core Developer for IT Company in SURAT,GUJARAT",2023-06-28T01:09:56Z,60000.0,40000.0,['France'],France,Apt Resources Private Limited,Emplois Informatique,it-jobs,
0,"Fondée en 1969, Cegedim est une entreprise innovante de technologies et de services spécialisée dans la gestion des flux numériques de l'écosystème santé et BtoB, ainsi que dans la conception de logiciels métiers destinés aux professionnels de santé et de l'assurance. Cegedim compte plus de 6000 collaborateurs dans plus de 10 pays et a réalisé un chiffre d'affaires de 555, 6 millions d'Euros en 2022. Cegedim est 6ème du truffle 100 en 2022 : https://www.truffle100.fr/2022.html et 9ème du top 25…",4224121031,Développeur Fullstack - Nantes H/F,2023-07-26T07:19:01Z,,,"['France', 'Pays de la Loire', 'Loire-Atlantique', 'Nantes', 'Rezé']","Rezé, Nantes",Cegedim,Emplois Informatique,it-jobs,
0,"Deine Tätigkeit Eigenverantwortliche Betreuung der BAUR IT Hard- & Software als Administrator:in Betreuung von Netzwerken, Windows Server- und Client-Systemen, Drucker sowie Windows-Betriebssystemen und Office-Standard-Programmen First-Level-Support für Mitarbeiter:innen Aktive Beteiligung an IT-Projekten Dein Profil Abgeschlossenes Informatikstudium Erste einschlägige Berufserfahrung von Vorteil Gute Englischkenntnisse Selbstständige und genaue Arbeitsweise Zuverlässige und kommunikative Persö…",4244333764,IT-Administrator:in & User Support (m/w/d),2023-08-05T12:30:19Z,60000.0,40000.0,['France'],France,Oehweb,Emplois Informatique,it-jobs,
0,"Expectra, leader en France de l'intérim spécialisé et du recrutement en CDI de cadres et agents de maîtrise. Les consultants du Département Informatique & Télécoms vous proposent des opportunités de carrière. Nous recherchons pour le compte de notre client un développeur FRONT END ANGULAR F/H en CDI. En méthode Agile, vous intégrer une équipe d'experts qui interviennent et propose une expertise en développement front end, mobile dans un environnement angular. L'entreprise dispose d'un vernis te…",4257091355,Développeurs Front Angular H/F,2023-08-12T18:25:13Z,45000.0,40000.0,"['France', 'Occitanie', 'Hérault', 'Montpellier', 'Montpellier 8e Canton']","Montpellier 8e Canton, Montpellier",Expectra,Emplois Informatique,it-jobs,
0,"Additi assure le développement des activités pub et numériques du Groupe Ouest France. Notre entreprise 100% Made in Breizh réunit plus de 700 collaborateurs et fédère les savoir-faire de différents sites d'annonces, régies publicitaires, radios, affichages et agence conseil. Tu es attiré.e par le monde des médias, de la pub et du numérique ? Nous recherchons notre futur·e développeur.se Fullstack H/F Tu intégreras la Business Unit Ouest France Emploi qui commercialise nos solutions SaaS de rec…",4214433693,Développeur Full Stack H/F,2023-07-20T07:53:23Z,,,"['France', 'Bretagne', 'Ille-et-Vilaine']","Ille-et-Vilaine, Bretagne",Additi,Emplois Informatique,it-jobs,
0,"Et si on vous proposait de faire le tour du monde ? Rejoignez la Marine Nationale et découvrez nos forces navales, aéronautiques navales et sous-marines ? En mer comme à terre, c'est toute une expertise?qui s'offre à vous.?Intégrez un environnement exceptionnel, unique, qui évolue en permanence.? Après une formation?initiale de 4 mois pour accéder au grade d'Officier marinier, vous?rejoignez une école de spécialité en vue d'être Technicien Systèmes d'Information et de Communication H/F et ainsi…",4243883144,Technicien des Systèmes Information et Télécommunication H/F,2023-08-05T06:06:47Z,,,"['France', 'Nouvelle-Aquitaine', 'Pyrénées-Atlantiques']","Pyrénées-Atlantiques, Nouvelle-Aquitaine",Manpower,Emplois Informatique,it-jobs,
0,Mise en place de l’infrastructure de monitoring (Nexthink) pour collecter des métriques pertinentes sur des centaines d’activités et de propriétés des postes de travail pour aider l’ensemble des intervenants à cerner un problème de l’infrastructure et y remédier. Mission(s) et Réalisations : Rédaction de DAS (Dossier Architecture de Sécurité) Spécifier et déterminer le système de cotation unique ou multi-cotation selon les profils techniques Analyses sur les échanges avec les responsables appli…,4254015883,architecte informatique NEXTHINK (IT),2023-08-10T21:47:57Z,750.0,500.0,"['France', 'Ile-de-France', 'Paris']","Paris, Ile-de-France",Groupe Aptenia,Emplois Informatique,it-jobs,contract
0,Get The Future You Want Envie de changer de carrière et/ou de cadre de vie ? Vous y pensez fortement mais vous n'osez pas franchir le pas ? Et si Orléans était la solution ? Allons faire un petit tour du côté de cette ville tant plébiscitée pour son art de vivre que pour son patrimoine culturel  Orléans est un petit coin de campagne situé à seulement 1h30 de Paris en train. C'est une ville qui présente une très grande richesse historique et patrimoniale (avec sa figure emblématique Jeanne d'Arc…,4216302507,Développeur Full Stack Confirmé Orléans H/F,2023-07-21T07:27:59Z,,,"['France', 'Centre', 'Loiret', 'Orléans', 'Saint-Jean-le-Blanc']","Saint-Jean-le-Blanc, Orléans",Capgemini,Emplois Informatique,it-jobs,
0,"Crédit Agricole Group Infrastructure Platform, CA-GIP, entité de production informatique du groupe Crédit Agricole recherche un(e) ingénieur d'infrastructure d'exploitation Onshore Unix/Linux. Contexte : Le Socle Open a pour vocation de porter la construction et le maintien en condition opérationnelle des plates-formes technologiques du monde Open en garantissant au quotidien la qualité de service. Il est en charge de l’optimisation technique et économique, en particulier via la mutualisation, …",4193946215,Ingénieur d'infrastructure d'exploitation Onshore Unix/Linux H/F,2023-07-07T08:52:55Z,80000.0,60000.0,"['France', 'Ile-de-France', 'Yvelines', 'Versailles']","Versailles, Yvelines",Crédit Agricole Group,Emplois Informatique,it-jobs,
0,"Qui sont-ils ? Médiamétrie est fière de ses 680 collaborateurs qui contribuent chaque jour à la mesure de l'audience TV, Radio et Internet. Véritable référent dans l'univers des médias, ils réalisent des études médias et accompagnent au quotidien plus de 1000 clients dans leur transformation numérique. Présent depuis 1985 et leader des études médias, ils observent, mesurent et analysent les comportements du public et les tendances du marché : streaming, catch-up, différé, 4 écrans. La connexion…",4222559440,CDI - Ingénieur Dev H/F,2023-07-25T08:37:21Z,,,"['France', 'Ile-de-France', 'Hauts-de-Seine', 'Nanterre', 'Levallois-Perret']","Levallois-Perret, Nanterre",Médiamétrie,Emplois Informatique,it-jobs,
0,"A la recherche d’un nouveau challenge?Cette opportunité est faite pour vous Pour notre client, acteur majeur de l’univers du luxe rejoignez l’équipe en charge des Infras Réseau. Principales Responsabilités Avec votre binôme, vous aurez en charge le projet de refresh Meraki de nombreux sites en Europe.Vous vous occuperez de la gestion de projet de bout en bout incluant: Pour mener à bien ces missions nous recherchons un ingénieur Réseau avec au moins 3 ans d’expérience et une expérience similair…",4175453938,Expert Réseau/Wifi,2023-06-29T01:53:15Z,60000.0,40000.0,"['France', 'Ile-de-France', 'Val-de-Marne', 'Nogent-sur-Marne', 'Fontenay-sous-Bois']","Fontenay-sous-Bois, Nogent-sur-Marne",SKILL EXPERT,Emplois Informatique,it-jobs,
0,"Ingénieur Système - Surveillance et Renseignement des Communications - F/H page is loaded Ingénieur Système - Surveillance et Renseignement des Communications - F/H Apply locations Cholet time type Full time posted on Posted 2 Days Ago job requisition id R0205523 QUI SOMMES-NOUS ? À Cholet, Thales conçoit, développe, intègre, qualifie, industrialise, produit, déploie et maintient en condition opérationnelle des équipements de radiocommunications et des réseaux tactiques militaires, des équipeme…",4209881425,Ingénieur Système - Surveillance et Renseignement des Communications - F/H,2023-07-17T11:25:50Z,60000.0,40000.0,"['France', 'Pays de la Loire', 'Maine-et-Loire', 'Cholet']","Cholet, Maine-et-Loire",Thales Group,Emplois Informatique,it-jobs,
0,"Ingénieur développement logiciel C++ sénior page is loaded Ingénieur développement logiciel C++ sénior Apply locations Vélizy-Villacoublay Gennevilliers time type Full time posted on Posted 4 Days Ago job requisition id R0217612 QUI SOMMES-NOUS ? Thales propose des systèmes d’information et de communication sécurisés et interopérables pour les forces armées, les forces de sécurité et les opérateurs d’importance vitale. Ces activités, qui regroupent radiocommunications, réseaux, systèmes de prot…",4173539776,Ingénieur développement logiciel C++ sénior,2023-06-27T19:58:45Z,80000.0,60000.0,"['France', 'Ile-de-France', 'Hauts-de-Seine', 'Nanterre', 'Gennevilliers']","Gennevilliers, Nanterre",Thales Group,Emplois Informatique,it-jobs,
0,"Absolut Sensing is developing the technologies necessary to monitor, understand and ultimately predict global changes. Our first mission is to support the fight against climate change by providing a satellite-based methane monitoring service to allow regulators and emitters worldwide to assess and reduce their emissions. Join us and make a difference Absolut Sensing is a rapidly growing company with ambitions beyond this first mission. We are an equal opportunity employer, offering competitive …",4173966092,SPACE SEGMENT PROJECT DELIVERY MANAGER,2023-06-28T01:09:14Z,60000.0,40000.0,"['France', 'Occitanie', 'Haute-Garonne', 'Toulouse']","Toulouse, Haute-Garonne",Absolut Sensing,Emplois Informatique,it-jobs,
0,"Il existe 300 métiers différents chez BNP Paribas. Développement Commercial, Informatique, Expertise Financière, Audit ou encore Consulting, c'est autant de possibilités de tracer son parcours professionnel en France ou à l'international  Référent Cybersécurité Concrètement votre quotidien ? La cybersécurité est un enjeu majeur pour vous ? En tant que référent Cybersécurité, vous nous rejoindrez pour contribuer à la détection des vulnérabilités et à la protection de nos actifs face aux menaces …",4239644983,Référent Cybersécurité H/F,2023-08-03T07:20:01Z,,,"['France', 'Ile-de-France', 'Seine-Saint-Denis', 'Bobigny', 'Montreuil']","Montreuil, Bobigny",BNP PARIBAS,Emplois Informatique,it-jobs,
0,"L'offre Je suis Yvonnick, consultant en recrutement au sein d'Externatic, je te propose aujourd’hui de découvrir l’offre ci-dessous et d’échanger ensemble : plutôt en visio ? Ou autour d’un verre ? Je serai ravi de t'accompagner et de te présenter ce job plus en détail  L'entreprise et l'équipe éditeur leader sur son marché spécialiste des solutions numériques pour les collectivités territoriales, dans les domaines de l’urbanisme, du foncier, du patrimoine et du scolaire accompagne  de 60% de m…",4236392342,Responsable R&D  Editions logiciels / ETi H/F,2023-08-01T20:22:04Z,60000.0,40000.0,"['France', 'Pays de la Loire', 'Loire-Atlantique', 'Nantes']","Nantes, Loire-Atlantique",Externatic,Emplois Informatique,it-jobs,
0,"Staycation, c’est l’app qui permet à chacun de s’évader facilement du quotidien. Staycation crée des expériences clés en main dans les meilleurs hôtels autour de soi. Depuis sa création en 2017, Staycation a contribué à transformer l’hôtellerie en profondeur : convertir les hôtels en de véritables lieux de vie au coeur des villes et les connecter à une toute nouvelle clientèle locale. Staycation, c’est à présent une communauté de plus de 2 millions d’utilisateurs et 1000 hôtels dans 5 pays. Pre…",4181296825,Fullstack Developer Node/React H/F (full remote possible),2023-07-01T09:59:09Z,80000.0,60000.0,"['France', 'Ile-de-France', 'Paris']","Paris, Ile-de-France",Staycation,Emplois Informatique,it-jobs,
0,"Qualis est une société d'intérim et de recrutement spécialisée dans le : Tertiaire (banque, assurance, comptabilité, centres d'appel, immobilier, transports) Informatique (infrastructure et sécurité, support aux utilisateurs, développement web) Industrie (Industrie et ingénierie, BTP et télécoms) Nous vous accompagnons partout en France dans vos recrutements en CDI, CDD et travail temporaire. Nos consultants en recrutement sont des experts métiers capables d'identifier vos problématiques. Colla…",4199601913,Technicien Informatique H/F,2023-07-11T07:57:57Z,,,"['France', ""Provence-Alpes-Côte d'Azur"", 'Bouches-du-Rhône', 'Aix-en-Provence', 'Aix-en-Provence-Sud-Ouest']","Aix-en-Provence-Sud-Ouest, Aix-en-Provence",Qualis Recrutement,Emplois Informatique,it-jobs,
0,"Rejoindre UTIGroup, c'est rejoindre une Société à taille humaine qui investit sur l'accompagnement de ses Consultants, et où la prise de décision est rapide. Certifiée ISO 9001/2015, UTIGroup a eu 35 ans en 2021. Solidité et transparence financière (notre société est cotée en Bourse depuis plus de 20 ans Notation ECO-Vadis exceptionnelle (73/100) : niveau PLATINIUM (RSE, éthique, social et achats responsables) UTIGroup respecte les textes internationaux, européens et la législation Française en…",4199596270,Ingénieur Système Windows Junior H/F,2023-07-11T07:57:45Z,33000.0,32000.0,"['France', 'Auvergne-Rhône-Alpes', 'Rhône']","Rhône, Auvergne-Rhône-Alpes",Utigroup,Emplois Informatique,it-jobs,
0,"Lancé en 2021, Team.is est une start-up de recrutement spécialisée dans la chasse et le recrutement de profils IT, Digital, Ingénierie & Supply Chain. Team.is c'est avant tout une entreprise à taille humaine animée par la passion du recrutement  Team.is possède l'expertise et l'énergie pour s'attaquer à n'importe quel défi. Mais nous ne sommes pas des robots du recrutement. Nous sommes des consultants qui vivent et respirent ce que nous faisons  Nous sommes déterminés à réaliser le meilleur tra…",4230202725,Ingénieur Software Robotique H/F,2023-07-29T05:48:10Z,65000.0,45000.0,"['France', 'Nouvelle-Aquitaine', 'Gironde', 'Bordeaux', 'Talence']","Talence, Bordeaux",Team.is,Emplois Informatique,it-jobs,
0,"QUI SOMMES-NOUS ? Thales propose des systèmes d’information et de communication sécurisés et interopérables pour les forces armées, les forces de sécurité et les opérateurs d’importance vitale. Ces activités, qui regroupent radiocommunications, réseaux, systèmes de protection, systèmes d’information critiques et cybersécurité, répondent aux besoins de marchés où l’utilisation des nouvelles technologies numériques est déterminante. Thales intervient tout au long de la chaîne de valeur, des équip…",4181756213,Administrateur Système et Sécurité (H/F),2023-07-01T11:32:37Z,60000.0,40000.0,"['France', 'Bretagne', 'Finistère', 'Brest']","Brest, Finistère",Réservoir Jobs,Emplois Informatique,it-jobs,
0,"Fullstack Job: Développeur(se) Fullstack senior (H-F) L'équipe Talents IT s'engage à être réactive et présente pour répondre à vos demandes. Nos consultants ont pour vocation de vous accompagner dans la recherche de vos futurs experts IT, en CDI et en CDD, quel que soit votre secteur d'activité. Description du poste : Talents IT cabinet de recrutement national spécialisé dans les métiers de l'IT et du Digital proche de ses clients et candidats est résolument tourné vers l'humain. Notre équipe s…",4173968966,Développeur(se) Fullstack senior (H-F),2023-06-28T01:09:29Z,60000.0,40000.0,"['France', 'Bretagne', 'Ille-et-Vilaine', 'Rennes']","Rennes, Ille-et-Vilaine",Talents IT,Emplois Informatique,it-jobs,
0,"Data Scientist Opération & Finance page is loaded Data Scientist Opération & Finance Apply locations Paris time type Full time posted on Posted 9 Days Ago job requisition id JOBREQ00078812 Lieu de travail : Basé au 136 avenue Charles de Gaulle, Neuilly-sur-Seine, des déplacements sont à prévoir occasionnellement sur nos sites en Europe. Rattachement hiérarchique : Head of Data Science & Advanced Analytics Business Services Platform Europe Contrat : CDI, temps plein. Votre rôle chez Chanel : La …",4185518202,Data Scientist Opération & Finance,2023-07-03T03:12:01Z,80000.0,60000.0,"['France', 'Ile-de-France', 'Paris']","Paris, Ile-de-France","Chanel, Inc.",Emplois Informatique,it-jobs,
0,"Description du poste Le Cabinet de recrutement Manpower NANTES INFORMATIQUE recherche pour son client, un acteur du secteur des technologies de pointe, électrique et électronique, un Développeur informatique PHP (H/F) Au sein de l'équipe Développement, vous aurez les missions suivantes: Intervenir dans votre domaine de compétences favoris selon vos compétences et aspirations professionnelles : développement, lead technique, pilotage de projet, Participer à la conception et au développement de l…",4173978966,Développeur Informatique PHP/Symfony,2023-06-28T01:10:40Z,60000.0,40000.0,"['France', 'Pays de la Loire', 'Maine-et-Loire', 'Cholet']","Cholet, Maine-et-Loire",Nefer IT SARL,Emplois Informatique,it-jobs,
0,"Le Groupe PIMENT et ses marques spécialisées OPTIMA et KUBIC vous accompagnent tout au long de votre évolution professionnelle, en vous proposant des contrats en intérim, CDD, CDI, assistance technique, freelance dans de nombreux secteurs d'activité. Nous apportons une vision et des méthodes de recrutement centrées sur les qualités humaines. Pour cela, nous proposons à nos clients des solutions de recrutement sur-mesure. Notre mission : trouver l'entreprise qui correspond à vos attentes et inve…",4199599735,Administrateur Reseau H/F,2023-07-11T07:57:52Z,,,"['France', ""Provence-Alpes-Côte d'Azur"", 'Bouches-du-Rhône', 'Marseille', 'Aubagne']","Aubagne, Marseille",Groupe Piment,Emplois Informatique,it-jobs,
0,"En tant que développeur(se) Python/C++, doté(e) d'une appétence Linux, tu : seras en charge de la conception, du développement et de la validation des applications produit. t'occuperas du suivi du processus de développement participeras à la maintenance des applications existantes développeras des outils en interne travailleras en collaboration avec le service exploitation et le service technique La stack technique : Python, C++, environnement Linux, MySql, Git, tests unitaires, test d'intégrat…",4175372911,Développeur python / c (h/f),2023-06-28T20:21:15Z,60000.0,40000.0,"['France', 'Occitanie', 'Hérault', 'Lodève', ""Clermont-l'Hérault""]","Clermont-l'Hérault, Lodève",Urban Linker,Emplois Informatique,it-jobs,
