salary_max,created,title,id,salary_is_predicted,description,salary_min,tag,category,area,location,company,contract_type
60000.0,2023-06-29T01:53:15Z,Expert Réseau/Wifi,4175453938,0,"A la recherche d’un nouveau challenge?Cette opportunité est faite pour vous Pour notre client, acteur majeur de l’univers du luxe rejoignez l’équipe en charge des Infras Réseau. Principales Responsabilités Avec votre binôme, vous aurez en charge le projet de refresh Meraki de nombreux sites en Europe.Vous vous occuperez de la gestion de projet de bout en bout incluant: Pour mener à bien ces missions nous recherchons un ingénieur Réseau avec au moins 3 ans d’expérience et une expérience similair…",40000.0,it-jobs,Emplois Informatique,"['France', 'Ile-de-France', 'Val-de-Marne', 'Nogent-sur-Marne', 'Fontenay-sous-Bois']","Fontenay-sous-Bois, Nogent-sur-Marne",SKILL EXPERT,
60000.0,2023-07-17T11:25:50Z,Ingénieur Système - Surveillance et Renseignement des Communications - F/H,4209881425,0,"Ingénieur Système - Surveillance et Renseignement des Communications - F/H page is loaded Ingénieur Système - Surveillance et Renseignement des Communications - F/H Apply locations Cholet time type Full time posted on Posted 2 Days Ago job requisition id R0205523 QUI SOMMES-NOUS ? À Cholet, Thales conçoit, développe, intègre, qualifie, industrialise, produit, déploie et maintient en condition opérationnelle des équipements de radiocommunications et des réseaux tactiques militaires, des équipeme…",40000.0,it-jobs,Emplois Informatique,"['France', 'Pays de la Loire', 'Maine-et-Loire', 'Cholet']","Cholet, Maine-et-Loire",Thales Group,
80000.0,2023-06-27T19:58:45Z,Ingénieur développement logiciel C++ sénior,4173539776,0,"Ingénieur développement logiciel C++ sénior page is loaded Ingénieur développement logiciel C++ sénior Apply locations Vélizy-Villacoublay Gennevilliers time type Full time posted on Posted 4 Days Ago job requisition id R0217612 QUI SOMMES-NOUS ? Thales propose des systèmes d’information et de communication sécurisés et interopérables pour les forces armées, les forces de sécurité et les opérateurs d’importance vitale. Ces activités, qui regroupent radiocommunications, réseaux, systèmes de prot…",60000.0,it-jobs,Emplois Informatique,"['France', 'Ile-de-France', 'Hauts-de-Seine', 'Nanterre', 'Gennevilliers']","Gennevilliers, Nanterre",Thales Group,
60000.0,2023-06-28T01:09:14Z,SPACE SEGMENT PROJECT DELIVERY MANAGER,4173966092,0,"Absolut Sensing is developing the technologies necessary to monitor, understand and ultimately predict global changes. Our first mission is to support the fight against climate change by providing a satellite-based methane monitoring service to allow regulators and emitters worldwide to assess and reduce their emissions. Join us and make a difference Absolut Sensing is a rapidly growing company with ambitions beyond this first mission. We are an equal opportunity employer, offering competitive …",40000.0,it-jobs,Emplois Informatique,"['France', 'Occitanie', 'Haute-Garonne', 'Toulouse']","Toulouse, Haute-Garonne",Absolut Sensing,
,2023-08-03T07:20:01Z,Référent Cybersécurité H/F,4239644983,0,"Il existe 300 métiers différents chez BNP Paribas. Développement Commercial, Informatique, Expertise Financière, Audit ou encore Consulting, c'est autant de possibilités de tracer son parcours professionnel en France ou à l'international  Référent Cybersécurité Concrètement votre quotidien ? La cybersécurité est un enjeu majeur pour vous ? En tant que référent Cybersécurité, vous nous rejoindrez pour contribuer à la détection des vulnérabilités et à la protection de nos actifs face aux menaces …",,it-jobs,Emplois Informatique,"['France', 'Ile-de-France', 'Seine-Saint-Denis', 'Bobigny', 'Montreuil']","Montreuil, Bobigny",BNP PARIBAS,
60000.0,2023-08-01T20:22:04Z,Responsable R&D  Editions logiciels / ETi H/F,4236392342,0,"L'offre Je suis Yvonnick, consultant en recrutement au sein d'Externatic, je te propose aujourd’hui de découvrir l’offre ci-dessous et d’échanger ensemble : plutôt en visio ? Ou autour d’un verre ? Je serai ravi de t'accompagner et de te présenter ce job plus en détail  L'entreprise et l'équipe éditeur leader sur son marché spécialiste des solutions numériques pour les collectivités territoriales, dans les domaines de l’urbanisme, du foncier, du patrimoine et du scolaire accompagne  de 60% de m…",40000.0,it-jobs,Emplois Informatique,"['France', 'Pays de la Loire', 'Loire-Atlantique', 'Nantes']","Nantes, Loire-Atlantique",Externatic,
80000.0,2023-07-01T09:59:09Z,Fullstack Developer Node/React H/F (full remote possible),4181296825,0,"Staycation, c’est l’app qui permet à chacun de s’évader facilement du quotidien. Staycation crée des expériences clés en main dans les meilleurs hôtels autour de soi. Depuis sa création en 2017, Staycation a contribué à transformer l’hôtellerie en profondeur : convertir les hôtels en de véritables lieux de vie au coeur des villes et les connecter à une toute nouvelle clientèle locale. Staycation, c’est à présent une communauté de plus de 2 millions d’utilisateurs et 1000 hôtels dans 5 pays. Pre…",60000.0,it-jobs,Emplois Informatique,"['France', 'Ile-de-France', 'Paris']","Paris, Ile-de-France",Staycation,
,2023-07-11T07:57:57Z,Technicien Informatique H/F,4199601913,0,"Qualis est une société d'intérim et de recrutement spécialisée dans le : Tertiaire (banque, assurance, comptabilité, centres d'appel, immobilier, transports) Informatique (infrastructure et sécurité, support aux utilisateurs, développement web) Industrie (Industrie et ingénierie, BTP et télécoms) Nous vous accompagnons partout en France dans vos recrutements en CDI, CDD et travail temporaire. Nos consultants en recrutement sont des experts métiers capables d'identifier vos problématiques. Colla…",,it-jobs,Emplois Informatique,"['France', ""Provence-Alpes-Côte d'Azur"", 'Bouches-du-Rhône', 'Aix-en-Provence', 'Aix-en-Provence-Sud-Ouest']","Aix-en-Provence-Sud-Ouest, Aix-en-Provence",Qualis Recrutement,
33000.0,2023-07-11T07:57:45Z,Ingénieur Système Windows Junior H/F,4199596270,0,"Rejoindre UTIGroup, c'est rejoindre une Société à taille humaine qui investit sur l'accompagnement de ses Consultants, et où la prise de décision est rapide. Certifiée ISO 9001/2015, UTIGroup a eu 35 ans en 2021. Solidité et transparence financière (notre société est cotée en Bourse depuis plus de 20 ans Notation ECO-Vadis exceptionnelle (73/100) : niveau PLATINIUM (RSE, éthique, social et achats responsables) UTIGroup respecte les textes internationaux, européens et la législation Française en…",32000.0,it-jobs,Emplois Informatique,"['France', 'Auvergne-Rhône-Alpes', 'Rhône']","Rhône, Auvergne-Rhône-Alpes",Utigroup,
65000.0,2023-07-29T05:48:10Z,Ingénieur Software Robotique H/F,4230202725,0,"Lancé en 2021, Team.is est une start-up de recrutement spécialisée dans la chasse et le recrutement de profils IT, Digital, Ingénierie & Supply Chain. Team.is c'est avant tout une entreprise à taille humaine animée par la passion du recrutement  Team.is possède l'expertise et l'énergie pour s'attaquer à n'importe quel défi. Mais nous ne sommes pas des robots du recrutement. Nous sommes des consultants qui vivent et respirent ce que nous faisons  Nous sommes déterminés à réaliser le meilleur tra…",45000.0,it-jobs,Emplois Informatique,"['France', 'Nouvelle-Aquitaine', 'Gironde', 'Bordeaux', 'Talence']","Talence, Bordeaux",Team.is,
60000.0,2023-07-01T11:32:37Z,Administrateur Système et Sécurité (H/F),4181756213,0,"QUI SOMMES-NOUS ? Thales propose des systèmes d’information et de communication sécurisés et interopérables pour les forces armées, les forces de sécurité et les opérateurs d’importance vitale. Ces activités, qui regroupent radiocommunications, réseaux, systèmes de protection, systèmes d’information critiques et cybersécurité, répondent aux besoins de marchés où l’utilisation des nouvelles technologies numériques est déterminante. Thales intervient tout au long de la chaîne de valeur, des équip…",40000.0,it-jobs,Emplois Informatique,"['France', 'Bretagne', 'Finistère', 'Brest']","Brest, Finistère",Réservoir Jobs,
60000.0,2023-06-28T01:09:29Z,Développeur(se) Fullstack senior (H-F),4173968966,0,"Fullstack Job: Développeur(se) Fullstack senior (H-F) L'équipe Talents IT s'engage à être réactive et présente pour répondre à vos demandes. Nos consultants ont pour vocation de vous accompagner dans la recherche de vos futurs experts IT, en CDI et en CDD, quel que soit votre secteur d'activité. Description du poste : Talents IT cabinet de recrutement national spécialisé dans les métiers de l'IT et du Digital proche de ses clients et candidats est résolument tourné vers l'humain. Notre équipe s…",40000.0,it-jobs,Emplois Informatique,"['France', 'Bretagne', 'Ille-et-Vilaine', 'Rennes']","Rennes, Ille-et-Vilaine",Talents IT,
80000.0,2023-07-03T03:12:01Z,Data Scientist Opération & Finance,4185518202,0,"Data Scientist Opération & Finance page is loaded Data Scientist Opération & Finance Apply locations Paris time type Full time posted on Posted 9 Days Ago job requisition id JOBREQ00078812 Lieu de travail : Basé au 136 avenue Charles de Gaulle, Neuilly-sur-Seine, des déplacements sont à prévoir occasionnellement sur nos sites en Europe. Rattachement hiérarchique : Head of Data Science & Advanced Analytics Business Services Platform Europe Contrat : CDI, temps plein. Votre rôle chez Chanel : La …",60000.0,it-jobs,Emplois Informatique,"['France', 'Ile-de-France', 'Paris']","Paris, Ile-de-France","Chanel, Inc.",
60000.0,2023-06-28T01:10:40Z,Développeur Informatique PHP/Symfony,4173978966,0,"Description du poste Le Cabinet de recrutement Manpower NANTES INFORMATIQUE recherche pour son client, un acteur du secteur des technologies de pointe, électrique et électronique, un Développeur informatique PHP (H/F) Au sein de l'équipe Développement, vous aurez les missions suivantes: Intervenir dans votre domaine de compétences favoris selon vos compétences et aspirations professionnelles : développement, lead technique, pilotage de projet, Participer à la conception et au développement de l…",40000.0,it-jobs,Emplois Informatique,"['France', 'Pays de la Loire', 'Maine-et-Loire', 'Cholet']","Cholet, Maine-et-Loire",Nefer IT SARL,
,2023-07-11T07:57:52Z,Administrateur Reseau H/F,4199599735,0,"Le Groupe PIMENT et ses marques spécialisées OPTIMA et KUBIC vous accompagnent tout au long de votre évolution professionnelle, en vous proposant des contrats en intérim, CDD, CDI, assistance technique, freelance dans de nombreux secteurs d'activité. Nous apportons une vision et des méthodes de recrutement centrées sur les qualités humaines. Pour cela, nous proposons à nos clients des solutions de recrutement sur-mesure. Notre mission : trouver l'entreprise qui correspond à vos attentes et inve…",,it-jobs,Emplois Informatique,"['France', ""Provence-Alpes-Côte d'Azur"", 'Bouches-du-Rhône', 'Marseille', 'Aubagne']","Aubagne, Marseille",Groupe Piment,
60000.0,2023-06-28T20:21:15Z,Développeur python / c (h/f),4175372911,0,"En tant que développeur(se) Python/C++, doté(e) d'une appétence Linux, tu : seras en charge de la conception, du développement et de la validation des applications produit. t'occuperas du suivi du processus de développement participeras à la maintenance des applications existantes développeras des outils en interne travailleras en collaboration avec le service exploitation et le service technique La stack technique : Python, C++, environnement Linux, MySql, Git, tests unitaires, test d'intégrat…",40000.0,it-jobs,Emplois Informatique,"['France', 'Occitanie', 'Hérault', 'Lodève', ""Clermont-l'Hérault""]","Clermont-l'Hérault, Lodève",Urban Linker,
60000.0,2023-08-05T12:36:35Z,Un.e chargé.e de développement des réseaux de chaleur,4244354002,0,"Un.e chargé.e de développement des réseaux de chaleur - Rouen - Métropole Rouen Normandie Référence de l'offre : PB04333/E3DR.DTE.23.17-BL Type d'emploi : Fonctionnaire / CDI Date limite de réponse à l'offre : 31/08/2023 Grade : Cadre d’emplois des ingénieurs territoriaux Au sein du service réseaux de chaleur et en lien avec le responsable du service et la chargée d’unité, vous pilotez le développement des réseaux de chaleur sur le territoire en collaboration avec les différentes directions de …",40000.0,it-jobs,Emplois Informatique,"['France', 'Normandie', 'Seine-Maritime', 'Rouen']","Rouen, Seine-Maritime",Metropole Rouen Normandie,
,2023-07-26T07:18:49Z,Ingenieur Infrastructure IT H/F,4224118997,0,"Dans le cadre d'un important avec un groupe leader dans son domaine, nous recherchons un Ingénieur Infrastructure IT. Intégré à l'équipe informatique et encadré par son responsable, vous êtes en charge de : Gérer l'ensemble de la configuration des systèmes informatiques du site : veiller à la fiabilité des systèmes et à la sécurité des données, superviser la maintenance des matériels et logiciels d'exploitation et assurer l'installation des équipements selon les standards du groupe. L'IT specia…",,it-jobs,Emplois Informatique,"['France', 'Ile-de-France', 'Yvelines', 'Versailles', 'Vélizy-Villacoublay']","Vélizy-Villacoublay, Versailles",Informatis,
60000.0,2023-06-28T01:09:47Z,Développeur Fullstack (H/F) - Nantes,4173972423,0,"Fondée en 1969, Cegedim est une entreprise innovante de technologies et de services spécialisée dans la gestion des flux numériques de l’écosystème santé et BtoB, ainsi que dans la conception de logiciels métiers destinés aux professionnels de santé et de l’assurance. Cegedim compte plus de 6000 collaborateurs dans plus de 10 pays et a réalisé un chiffre d’affaires de 555,6 millions d’euros en 2022. Cegedim est 6ème du truffle 100 en 2022 : https://www.truffle100.fr/2022.html et 9ème du top 250…",40000.0,it-jobs,Emplois Informatique,"['France', 'Pays de la Loire', 'Loire-Atlantique', 'Nantes']","Nantes, Loire-Atlantique",CEGEDIM,
60000.0,2023-08-01T20:25:32Z,Développeur fullstack PhP Senior (F/H),4236406420,0,"Qui est Dilitrust ? DiliTrust est LA solution SaaS de référence utilisant l’IA pour accompagner les directions juridiques et la gouvernance d’entreprise. Nous améliorons le quotidien des juristes, des conseils et des dirigeants, en apportant des solutions sécurisées qui accélèrent leur transformation digitale. La suite DiliTrust Governance révèle tout le savoir faire de nos clients, leur simplifie le quotidien avec des solutions technologiques avancées et un service “premium”, au plus proche de…",40000.0,it-jobs,Emplois Informatique,"['France', 'Ile-de-France', 'Hauts-de-Seine', 'Nanterre', 'Puteaux']","Puteaux, Nanterre",DiliTrust,
,2023-07-21T06:24:24Z,Chef de Projet Senior IT E-Commerce - CDI H/F,4216194747,0,"Présentation Wonderbox est le leader européen des coffrets cadeaux et le spécialiste dans la vente d'activités de loisirs sur internet. Avec près de 450 collaborateurs, et un chiffre d'affaires de 250 millions d'Euros, nos produits sont distribués en France, Espagne, Italie, Belgique, Suisse, Pays-Bas, Portugal, Danemark, Suède, Norvège et USA. Notre mission ? Réaliser les rêves de nos clients et leur offrir des solutions originales de cadeaux clés en main dans l'univers des loisirs (Bien-être,…",,it-jobs,Emplois Informatique,"['France', 'Ile-de-France', 'Paris', '1er Arrondissement']","1er Arrondissement, Paris",Wonderbox,
60000.0,2023-07-14T11:24:54Z,Incident Manager - Lille H/F,4205502465,0,"L'activité Workplace Infra Innovation Services d'Econocom recrute un Incident Manager H/F pour accompagner les projets de transformation digitale d'un client grand compte dans la région lilloise. Vous intégrez l'agence Nord Normandie pour participer à des projets d'envergures chez un client grand compte. Au sein du pôle de compétences spécialisée dans la gestion des processus et de la qualité, vous évoluez sur les missions suivantes : Missions de Knowledge Manager : Gérer la base de connaissanc…",40000.0,it-jobs,Emplois Informatique,['France'],France,Econocom,
,2023-07-20T07:52:41Z,Développeur Front-End - Alternance 69 H/F,4214429199,0,"L'entreprise Il s'agit d'une entreprise qui édite, héberge et intègre des solutions à destination d'établissements publics et privés dans le domaine médical. Vous êtes en recherche d'un nouveau challenge professionnel après une première expérience significative en développement front-end ? Vous souhaitez contribuer à votre façon au domaine de la santé ? Description du poste Rattaché.e au département solutions (qui regroupe Dev  QA  Design  Produit  Infra), vous êtes intégré.e à une équipe hybri…",,it-jobs,Emplois Informatique,"['France', 'Auvergne-Rhône-Alpes', 'Rhône']","Rhône, Auvergne-Rhône-Alpes",Live Campus,
80000.0,2023-08-14T10:02:02Z,Lead développeur Back-end IoT (F/H),4259011101,0,"Atral Security fait partie du Groupe Atraltech, leader en technologies de sécurité anti-intrusion et anti-incendie professionnelles en Europe, présent en France, en Allemagne et en Italie, dont deux usines situées en France : Chavanod (Haute-Savoie) et Villard Bonnot (Isère). Le Groupe Atraltech compte plus de 350 collaborateurs dans le monde, réinvestit 10% de son chiffre d’affaires en R&D, et dispose d’un réel savoir-faire, avec plus de 50 ingénieurs et techniciens dédiées à l’élaboration de …",60000.0,it-jobs,Emplois Informatique,['France'],France,Atraltech,
450.0,2023-08-01T21:34:52Z,Senior Java Développeur (IT),4236480836,0,"Chez EyeTech Solutions, nous recherchons un Senior Java Développeur talentueux et passionné, ayant une expérience en conception et développement de logiciels pour des environnements distribués, en tirant parti des microservices et de l'architecture cloud. Le candidat idéal aura une solide compréhension des motifs de conception asynchrones et axés sur les événements, des environnements AWS et des méthodologies agiles. En tant que Senior Java Développeur, vous serez responsable de concevoir et dé…",350.0,it-jobs,Emplois Informatique,"['France', 'Ile-de-France', 'Paris', '9ème Arrondissement']","9ème Arrondissement, Paris",EYETECH SOLUTIONS,contract
46000.0,2023-08-05T06:06:49Z,Expert Fonctionnel SIRH et Gta H/F,4243883229,0,"Page Personnel Ressources Humaines dispose d'une solide expérience pour accompagner ses clients dans leurs prochains recrutements de Techniciens, d'Agents de Maîtrise et de cadres de premier niveau. Nous intervenons dans tous les secteurs d'activité, pour tous types d'entreprises et nos principaux recrutements concernent des postes de Gestionnaire de Paie, d'Assistant RH, de Chargé de Recrutement. Nous recherchons pour notre client un Expert Fonctionnel SIRH et GTA. Poste basé sur la commune de…",42000.0,it-jobs,Emplois Informatique,"['France', 'Auvergne-Rhône-Alpes', 'Rhône', 'Lyon', 'Limonest']","Limonest, Lyon",Page Personnel,
80000.0,2023-07-14T08:23:44Z,Architecte OMS,4205077956,0,"France / Freelance / Paris / Architecte / OMS / E-commerce / Salesforce Je recherche actuellement un Architecte sur la partie OMS pour une mission en Ile de France. Des connaissances Salesforce et/ou e-commerce sont un plus mais le besoin est sur la partie OMS Description : vous êtes le garant des solutions techniques, point de contact privilégié pour toute nouvelle conception ou intégration d'un nouveau service. L'architecte IT digital est le pivot entre les équipes projets agiles et l'équipe …",60000.0,it-jobs,Emplois Informatique,"['France', 'Ile-de-France', 'Paris']","Paris, Ile-de-France",Lawrence Harvey Search & Selection,
,2023-07-21T06:24:48Z,Developpeur C# H/F,4216197364,0,"Description entreprise : Rejoindre AKANEA, c'est rejoindre une entreprise de 250 salariés, filiale du groupe ISAGRI, avec un ambitieux projet de croissance, acteur majeur de ses marchés équipant de très belles références avec une large gamme innovante et fiable. C'est aussi intégrer une entreprise certifiée Great Place to Work, autrement dit où il fait bon travailler avec les valeurs humaines comme élément clé de sa réussite (10% de croissance/an). L'équipe dynamique et joviale d'AKANEA vous at…",,it-jobs,Emplois Informatique,"['France', 'Auvergne-Rhône-Alpes', 'Rhône', 'Lyon', 'Limonest']","Limonest, Lyon",Akanea Développement,
60000.0,2023-06-28T01:09:13Z,Head Hunter / Manager(euse) de l'équipe tech de notre bureau de Bordeaux - 60/80 k€,4173965784,0,"Head Hunter / Manager(euse) de l'équipe tech de notre bureau de Bordeaux - 60/80 k€ Head Hunter / Manager(euse) de l'équipe tech de notre bureau de Bordeaux - 60/80 k€ Offre publiée le 10-09-2021. Bordeaux Fonction Directeur de clientele Taille entreprise de 11 à 20 Teletravail partiel Expérience 6 à 10 ans Expérience Plus de 10 ans Nous recrutons l es équipes de la French Tech (Blablacar, Sézane, Getaround, Payfit, ) et construisons le cabinet de chasse référent dans le recrutement des talents…",40000.0,it-jobs,Emplois Informatique,"['France', 'Nouvelle-Aquitaine', 'Gironde', 'Bordeaux']","Bordeaux, Gironde",Data Recrutement,
80000.0,2023-08-05T11:28:42Z,Chef de Projets MOA D365 F&O TMS - Client Final - Déploiement ERP International H/F,4244208360,0,"Chef de Projets MOA D365 F&O TMS - Client Final - Déploiement ERP International H/F Leader de la distribution de produits pharmaceutiques à l'étranger ERP - Dynamics - 365 - F&O - WMS/TMS - International - Déploiement Notre client est le leader de la distribution de produits pharmaceutiques à l'étranger. Dans le cadre d'un projet d'envergure de changement d'ERP, le client recherche un Chef Projets MOA MS Dynamics 365 F&O qui interviendra sur la partie TMS, dans le paramétrage et le déploiement …",60000.0,it-jobs,Emplois Informatique,"['France', 'Ile-de-France', 'Hauts-de-Seine', 'Boulogne-Billancourt']","Boulogne-Billancourt, Hauts-de-Seine",Michael Page ,
,2023-07-11T07:57:58Z,Analyste Developpeur Mainframe H/F,4199602268,0,"HN est une Entreprise de Services Numériques fondée en 1983, composée de plus de 1650 collaborateurs. Nous accompagnons nos clients, des groupes institutionnels diversifiés (banque, assurance, distribution, industrie, services), dans l'évolution permanente de leurs systèmes d'informations. Nous sommes présents en France (Paris, Lille, Nantes & Aix-en-Provence) et à l'international (Bucarest, Madrid, Lisbonne, Luxembourg & New-York) Nos métiers : MOE, BI, MOA, Prod/infra sur plus de 130 clients …",,it-jobs,Emplois Informatique,"['France', 'Ile-de-France']","Ile-de-France, France",HN Services,
60000.0,2023-06-28T01:10:35Z,Ingénieur·e Java Fullstack H/F,4173977913,0,"Vous êtes développeur Java et on vous reconnait pour votre créativité ? Aujourd’hui, vous avez envie d’intégrer une équipe au sein de laquelle vous pourrez apprendre et partager vos connaissances ? Alors, nous avons la mission qu’il vous faut  Nous recherchons un profil Ingénieur Java Fullstack (70% Back et 30% Front) pour rejoindre la DSI de notre client dans le secteur Bancaire. En relation avec le leader technique et le chef de projet fonctionnel, vous prendrez en charge les différents besoi…",40000.0,it-jobs,Emplois Informatique,['France'],France,Attineos,
60000.0,2023-07-21T06:24:00Z,Ingénieur Système Métriques de Performance H/F,4216186504,0,"Qui sommes nous Euro-Information, filiale technologique de Crédit Mutuel Alliance Fédérale, conçoit, réalise, maintient et exploite un système d'information commun utilisé par le Groupe. Les activités de développement et de production informatique au niveau national et international sont assurées par environ 4000 salariés répartis sur plusieurs sites géographiques au niveau national : Strasbourg, Nancy, Dijon, Orléans, Lyon, Lille, Cergy, Val de Fontenay, Paris et Nantes. Première Banque à adop…",35000.0,it-jobs,Emplois Informatique,"['France', 'Auvergne-Rhône-Alpes', 'Rhône', 'Lyon', 'Tassin-la-Demi-Lune']","Tassin-la-Demi-Lune, Lyon",EURO INFORMATION PRODUCTION,
40000.0,2023-08-11T06:45:11Z,Chef de Projet Applicatif H/F,4254633003,0,"Vous voulez intégrer une PME en pleine croissance ? Une équipe dynamique ? Des projets intéressants ? Rejoignez les équipes de notre client partenaire en tant que Chef de projet F/H, votre rôle sera de coordonner le déploiement de la solution logicielle chez les nouveaux clients. Vos responsabilités seront les suivantes : - Réaliser l'analyse et valider la reprise des données en collaboration avec notre référent ""récupération de données"" - Effectuer le paramétrage des solutions - Assurer la for…",35000.0,it-jobs,Emplois Informatique,"['France', 'Auvergne-Rhône-Alpes', 'Rhône', 'Lyon', 'Décines-Charpieu']","Décines-Charpieu, Lyon",Groupagora,
60000.0,2023-07-11T19:53:49Z,IT Project Manager (Remote Brazil),4200462848,0,"Job Description Rimini Street, Inc., is a fast-growing global leader delivering unified software support and services. We empower licensees of Oracle, SAP, IBM, Microsoft, Salesforce®, and other cloud and locally hosted enterprise software to extract more value from their investments, advance innovation, create competitive advantage, and fuel growth. With nearly 5000 clients served to date, we are the largest independent, full-stack ERP support and services company. Organizations who rely on ou…",40000.0,it-jobs,Emplois Informatique,['France'],France,"Rimini Street, Inc.",
